ID;Name;Description;ImageUrl;ReleaseDate;DiscontinuedDate;Price;Height;Width;Depth;Quantity
3pvX6KC95oQNQ1FvcsUAXjkOO;El Código Da Vinci;Robert Langdon recibe una llamada en mitad de la noche: el conservador del museo del Louvre ha sido asesinado en extrañas circunstancias y junto a su cadáver ha aparecido un desconcertante mensaje cifrado. Al profundizar en la investigación, Langdon, experto en simbología, descubre que las pistas conducen a las obras de Leonardo Da Vinci… y que están a la vista de todos, ocultas por el ingenio del pintor.;;2010-07-6;;89000;19;12.5;3.5;30
Gx0J4oHvWko85M4GGte6mtFSe;Satanás;Una mujer hermosa e ingenua que roba con destreza a altos ejecutivos, un pintor habitado por fuerzas misteriosas, y un sacerdote que se enfrenta a un caso de posesión demoníaca en La Candelaria, el barrio colonial de Bogotá… historias que se tejen en torno a la de Campo Elías, héroe de la guerra de Vietnam, quien inicia su particular descenso a los infiernos obsesionado por la dualidad entre el bien y el mal, entre Jekyll y Hyde, y se convertirá en un ángel exterminador.;;2019-11-19;;89000;28;21;1.5;25
C4i5VTlYc84ETdYXMFR38VTWo;El Cuarto Mono;"El detective de la policía de Chicago Sam Porter investiga el caso de un hombre atropellado, pues los indicios en la escena del crimen apuntan a que se trata de El Cuarto Mono, un asesino en serie que ha estado aterrorizando la ciudad. Su modus operandi consistía en enviar tres cajas blancas a los padres de las víctimas que secuestra y mata: una primera con una oreja, una segunda con los dos ojos, y otra con la lengua; para finalmente dejar abandonado el cuerpo sin vida en algún lugar.";;2023-06-7;;43699;19;12.5;2.7;30
pVvCeMLwHulv57SPjkiplRo8q;La Metamorfosis;La historia trata sobre Gregorio Samsa, cuya repentina transformación en un enorme insecto dificulta cada vez más la comunicación de su entorno social con él, hasta que es considerado intolerable por su familia y finalmente perece.;;2011-04-11;;65000;18;12;0.7;28
9quQC0l3yFv9kXB4J3VjO8AxX;Ángeles y Demonios;Robert Langdon, experto en simbología, es convocado a un centro de investigación suizo para analizar un misterioso signo marcado a fuego en el pecho de un físico asesinado. Allí, Langdon descubre el resurgimiento de una antigua hermandad secreta: los illuminati, que han emergido de las sombras para llevar a cabo la fase final de una legendaria venganza contra su enemigo más odiado: la Iglesia católica.;;2011-01-11;;89000;19;12.5;3.7;15
